,Topic_Num,Topic_Perc_Contrib,Keywords,Text
0,0.0,0.469,"жизнь, человек, нужный, делать, проблема, цель, желание, работа, отношение, мысль","""Счастье это выбор. Вы можете быть счастливыми. В жизни всегда будет стресс, но это ваш выбор, разрешите ли вы этому повлиять на вас или нет ». - Валери Бертинелли Я обнаружил, что в этом мире есть два типа людей.Те, кто предпочитают быть счастливыми и теми, кто не хочет этого делать. Я всегда задавался вопросом, почему некоторые люди выбирают счастье, а другие нет? Почему мы все не хотим быть счастливыми? И что делают люди, которые решили быть счастливыми? Вот что я нашел. У них есть цели ""То, что вы получаете, достигая своих целей, не так важно, как то, чем вы становитесь, достигая своих целей."" - Зиг Зиглар Счастливые люди всегда работают над значимыми целями в жизни. Хотя они заботятся о результатах, они больше озабочены тем, кем они становятся, чем там, где они идут. Они следуют за своей страстью. «Следуйте за своей страстью, будьте готовы много работать и жертвовать, и, прежде всего, не позволяйте никому ограничивать ваши мечты». - Донован Бэйли Счастливые люди обладают способностью находить и преследовать свои страсти в жизни. Они нашли способ адаптировать свою жизнь таким образом, чтобы они могли тратить свое время на то, что они любят. Не поймите меня неправильно, они работают и приносят жертвы по пути, но при этом на то, что они любят больше всего. Они тщательно выбирают своих друзей «Вы в среднем пятеро человек, с которыми мы проводим больше всего времени». - Джим Рон Счастливые люди знают, что их друзья могут либо оказывать положительное, либо отрицательное влияние на свою жизнь. Они счастливы, потому что они окружают себя позитивными и оптимистичными людьми, которые помогают им достичь своих целей. Они благодарны за то, что у них есть «Я счастлив, потому что я благодарен. Я хочу быть благодарным. Эта благодарность позволяет мне быть счастливой ». - Будет Арнетт Счастливые люди ценят то, что у них уже есть в жизни. Они довольны тем, что у них есть, и они считают свои благословения вместо того, чтобы вожделевать после следующего блестящего объекта. Им не хочется, чтобы они выходили и покупали вещи, чтобы быть счастливыми. Они искренне благодарны за то, что они уже получили. Они служат другим «Единственный смысл жизни - служить человечеству». - Лев Толстой Счастливые люди всегда помогают другим. Они знают, что существует сильная связь между оказанием помощи другим и счастливым. Они обнаружили, что служение другим - отличный способ испытать позитивные изменения в их собственной жизни. Они согласны с тем, что они не могут изменить «Счастье может существовать только в принятии». - Джордж Оруэлл Счастливые люди знают, что есть некоторые вещи, которые находятся вне их контроля. Вещи, которые они не могут изменить. Вместо того, чтобы бороться с этими ситуациями, они научились принимать вещи такими, какие они есть, и делать все возможное. Они фокусируют свое здоровье «Хорошо выглядят и чувствуют себя хорошо, идут рука об руку. Если у вас здоровый образ жизни, ваша диета и питание установлены, и вы будете работать, вам будет хорошо ». - Джейсон Стэтхэм Счастливые люди знают, что забота о своем здоровье важна. Они тратят время на физическое и психическое здоровье. Они едят правильно, упражняются и справляются со своим стрессом. Они знают, что забота о своем теле влияет на их энергетический уровень, способность сосредоточиться и свои чувства."
1,1.0,0.6264,"фотография, очень, фото, стоять, снимать, вкус, камера, получить, фотограф, делать","посмотреть модель на сайте Вот сижу смотрю на стенания вебдизайнеров. Приходит в группу ФБ владелец интернет магазина и просит оценить его сайт, мол что нужно поправить. Тут же появляется рой дизайнеров, сайтостроителей, продвигателей, поисковых оптимизаторов и все они начинают хором гудеть, некоторые заламывая руки: у вас старый движок, у вас непонятные цвета, ваш шрифт не гармонирует, дизайн прошлого века, такое нельзя оптимизировать, выбросьте это немедленно. И советы: все переделать, все поменять, оптимизировать и продвигать, и в довесок ценники (сайт, продвижение все не меньше чем по 300 тыс) и тут же ""я представитель конторы или у меня есть знакомые которые все это могут сделать"". Понятно, что они хотят заработать на очередном клиенте, который жалостно соглашается с любой критикой. И при этом, соглашаясь, владелец магазина будет вынужден переложить все свои расходы на покупателей. В этом диалоге нет только одной стороны - покупателя. Никто не спрашивает его, готов ли он переплачивать за ""модный в этом сезоне дизайн"", который кроме него никто и не увидит. Или он согласен купить в магазине не с дизайном от Лебедева, но в полтора раза дешевле. Главное в магазине для покупателя - это товар. Покупатель ходит в магазин не как на выставку живописи, получить вдохновение и выйти с буклетом, а чтобы купить нужный ему товар. Если в магазине нет товара, то хоть какой там будет дизайн - все равно покупать будет нечего. В магазине может быть прекрасный поиск, но если все платья представлены только ростом 170, то невысоким там делать просто нечего. Если бы можно было фильтровать одежду по ростам-размерам (рост + 3 обхвата) - то из сотен наименований на экране для большинства осталось бы 5-10 моделей (а для некоторых и пустой экран). Чем отличается наш магазин выкроек - ассортиментом и тем, что у нас есть практически любой размер. И не просто любой размер, а можно еще учесть индивидуальные особенности фигуры. Конечно можно поправить сайт, его можно править каждый день до бесконечности - но это никак не отразится на выкройках. Поэтому выбирая чем заняться в первую очередь мы выбираем выкройки, а сайт - ну тоже когда-то доработаем и его. 4604 ПЛАТЬЕ С БОЛЕРО РЕКОМЕНДАЦИИ ПО ВЫБОРУ ТКАНИ: плательные ткани из натуральных или смесовых волокон. А ТАКЖЕ ВАМ НЕОБХОДИМО: клеевая прокладка; подкладочная ткань; потайная застёжка–молния. ЕСЛИ НА ЛЕКАЛАХ ДВОЙНОЙ КОНТУР, ТО ЛЕКАЛА ДАНЫ С ПРИПУСКАМИ НА ШВЫ, ЕСЛИ КОНТУР ОДИНАРНЫЙ, ТО ЛЕКАЛА ДАНЫ БЕЗ ПРИПУСКОВ НА ШВЫ. ПРИПУСКИ НА ШВЫ: все швы 1 см; припуск на подгибку низа платья и низа рукава болеро – 2.0 см. ВНИМАНИЕ! ПРЕЖДЕ ВСЕГО, РАСПЕЧАТАЙТЕ БУМАЖНЫЕ ВЫКРОЙКИ И РАЗЛОЖИТЕ ИХ НА ШИРИНУ ТКАНИ (ширина ткани может быть от 90см до 150см) ДЛЯ ТОГО, ЧТОБЫ ВЫЯСНИТЬ, СКОЛЬКО МАТЕРИАЛА ВАМ ПОТРЕБУЕТСЯ (не забудьте учесть парные и симметричные детали). ПРИ СТАЧИВАНИИ ДЕТАЛЕЙ ОБРАЩАЙТЕ ВНИМАНИЕ НА НАДСЕЧКИ - ОНИ ДОЛЖНЫ СОВПАДАТЬ! РАСКРОЙ: Платье: Из основной ткани: 1. Центральная часть спинки - 2 детали 2. Боковая часть спинки - 2 детали 3. Центральная часть полочки – 2 детали 4. Боковая часть полочки - 2 детали 5. Обтачка спинки - 2 детали 6. Обтачка полочки - 1 деталь Из клеевой прокладки: 1. Обтачка спинки - 2 детали 2. Обтачка полочки - 1 деталь Болеро: Из основной ткани: 1. Спинка - 1 деталь со сгибом 2. Полочка - 1 деталь со сгибом 3. Рукав – 2 детали Из подкладочной ткани: 1. Спинка - 1 деталь со сгибом 2. Полочка - 1 деталь со сгибом ОПИСАНИЕ РАБОТЫ: Обработка платья. 1. Продублировать обтачки клеевой прокладкой. 2. Стачать рельефные срезы спинки. Припуски заутюжить к центру и обметать. 3. Обметать средний срез спинки отдельно на каждой детали. Стачать средний срез спинки от метки молнии до низа, припуски разутюжить. Втачать застежку – молнию. 4. Стачать рельефные срезы полочки. Припуски заутюжить к центру и обметать. 5. Стачать плечевые и боковые срезы, припуски заутюжить на спинку и обметать. 6. Стачать плечевые и боковые срезы обтачек, припуски разутюжить. Обметать нижний срез. Наложить обтачку на горловину лицевыми сторонами внутрь и обтачать. Припуски рассечь, отвернуть обтачку на изнаночную сторону и приутюжить. Обтачать пройму в два приема: сначала пройму полочки, затем пройму спинки. 7. Нижний срез платья обметать, заутюжить на изнаночную сторону и настрочить. Обработка болеро. 1. Стачать вытачки на детали полочки, заутюжить глубины вверх. 2. Стачать плечевые и боковые срезы, припуски разутюжить. 3. Стачать плечевые и боковые срезы подкладки, припуски разутюжить. 4. Сложить болеро с подкладкой лицевыми сторонами внутрь и обтачать горловину и нижний срез. Припуски на закруглениях рассечь, вывернуть болеро на лицевую сторону, выправить, приутюжить. Скрепить по срезам проймы и далее обрабатывать как одну деталь. 5. Стачать шов рукава, припуски заутюжить на заднюю часть и обметать. Втачать рукава в проймы, совмещая надсечки. Припуски приутюжить и обметать. 6. Нижний срез рукава обметать, заутюжить на изнаночную сторону и настрочить."
